{
  "appHost": {
    "path": "apphost.ts"
  },
  "sdk": {
    "version": "13.3.0-preview.1.26163.4"
  },
  "channel": "daily",
  "packages": {
    "Aspire.Hosting.Python": "13.3.0-preview.1.26167.8",
    "Aspire.Hosting.PostgreSQL": "13.3.0-preview.1.26167.8",
    "Aspire.Hosting.JavaScript": "13.3.0-preview.1.26167.8"
  },
  "profiles": {
    "https": {
      "applicationUrl": "https://rpsarena.dev.localhost:16323;http://rpsarena.dev.localhost:15163",
      "environmentVariables": {
        "ASPIRE_DASHBOARD_OTLP_ENDPOINT_URL": "https://rpsarena.dev.localhost:35807",
        "ASPIRE_RESOURCE_SERVICE_ENDPOINT_URL": "https://rpsarena.dev.localhost:32833"
      }
    }
  }
}
